[
    {
        "description": "Off-air proxy", 
        "format": "urn:x-nmos:format:video", 
        "tags": {}, 
        "label": "Off-air proxy", 
        "version": "1441724130:194944510", 
        "parents": [],
        "source_id": "c7b1c809-84d4-427d-b6bb-c8397c66ce2b", 
        "id": "0c1f03d7-7e94-4b21-94d1-3ffbee8a0606"
    }, 
    {
        "description": "Off-air", 
        "format": "urn:x-nmos:format:video", 
        "tags": {}, 
        "label": "Off-air", 
        "version": "1441724130:186085940", 
        "parents": [],
        "source_id": "c7b1c809-84d4-427d-b6bb-c8397c66ce2b", 
        "id": "0e85d87b-4b19-4452-aea3-984c9f94bbc9"
    }, 
    {
        "description": "Capture Audio Proxy", 
        "format": "urn:x-nmos:format:audio", 
        "tags": {
            "host": [
                "host1"
            ]
        }, 
        "label": "Capture Audio Proxy", 
        "version": "1441812152:154331951", 
        "parents": [],
        "source_id": "2aa143ac-0ab7-4d75-bc32-5c00c13d186f", 
        "id": "b3bb5be7-9fe9-4324-a5bb-4c70e1084449"
    }
]
