{
    "description": "Capture Audio Proxy", 
    "format": "urn:x-nmos:format:audio", 
    "tags": {
        "host": [
            "host1"
        ]
    }, 
    "label": "Capture Audio Proxy", 
    "version": "1441812152:154331951", 
    "parents": [],
    "source_id": "2aa143ac-0ab7-4d75-bc32-5c00c13d186f", 
    "id": "b3bb5be7-9fe9-4324-a5bb-4c70e1084449"
}
