[
    {
        "description": "Test Card", 
        "tags": {}, 
        "format": "urn:x-nmos:format:video", 
        "label": "Test Card", 
        "version": "1441704616:587121295", 
        "parents": [],
        "source_id": "02c46999-d532-4c52-905f-2e368a2af6cb", 
        "id": "5fbec3b1-1b0f-417d-9059-8b94a47197ed"
    },
    {
        "description": "VANC Data", 
        "tags": {}, 
        "format": "urn:x-nmos:format:data", 
        "label": "VANC Data", 
        "version": "1453880607:123995943", 
        "parents": [], 
        "source_id": "0e635152-e501-4d4e-bb87-9f3fe05eb79a", 
        "id": "db3bd465-2772-484f-8fac-830b0471258b"
    }
]
